{
  "id": "damped-oscillation",
  "title": "Damped Oscillation: Why Real Springs Stop",
  "eyebrow": "Scene 9 · damping",
  "language": "en",
  "duration": 49,
  "topic": "Damped harmonic oscillator — adding a velocity-proportional drag b·v turns Hooke's law into m·ẍ + b·ẋ + k·x = 0; the underdamped solution is x(t) = A·e^(-γt)·sin(ωt + φ) with γ = b/2m, and increasing γ takes the system from underdamped through critical to overdamped",
  "prerequisites": ["spring-oscillation"],
  "beats": [
    {
      "id": "manimoIntro",
      "start": 0,
      "end": 5.44,
      "narration": "Pull a real spring, let it go — it bobs, then stops. What slows it down?",
      "visuals": {
        "layout": "center",
        "elements": [
          { "type": "manimo-enter", "content": "Manimo bobs in centre-screen", "delay": 0 },
          { "type": "text-caption", "content": "Pull a real spring, release — what makes it stop?", "delay": 0.7, "color": "var(--chalk-100)", "position": "right of Manimo, serif italic" }
        ]
      }
    },
    {
      "id": "addDrag",
      "start": 5.44,
      "end": 15.74,
      "narration": "Add air resistance — a drag force proportional to velocity. Newton's law gains a new term: m x double dot plus b x dot plus k x equals zero.",
      "visuals": {
        "layout": "top-bottom",
        "elements": [
          { "type": "svg-path", "content": "Hatched wall on left, spring + mass displaced right, equilibrium dashed line", "delay": 0.0, "color": "var(--chalk-300)" },
          { "type": "svg-path", "content": "Restoring spring force arrow F = -kx pointing left from the mass", "delay": 0.6, "color": "var(--rose-400)" },
          { "type": "svg-path", "content": "Velocity arrow v on the mass pointing right (mass moving away from equilibrium)", "delay": 1.2, "color": "var(--chalk-200)" },
          { "type": "svg-path", "content": "Drag force arrow F_drag = -bv pointing left (opposite to v)", "delay": 1.8, "color": "var(--teal-400)" },
          { "type": "svg-label", "content": "−bv label above drag arrow", "delay": 2.2, "color": "var(--teal-400)" },
          { "type": "text-caption", "content": "drag opposes motion, always", "delay": 3.0, "color": "var(--chalk-300)", "position": "below the diagram, sans 14" },
          { "type": "text-formula", "content": "m ẍ + b ẋ + k x = 0", "delay": 5.0, "color": "var(--amber-300)", "position": "centre-bottom, large serif italic amber" }
        ]
      }
    },
    {
      "id": "solution",
      "start": 15.74,
      "end": 26.04,
      "narration": "Divide by m, set gamma equal to b over two m, and the underdamped solution turns out to be a sine wave whose amplitude decays exponentially.",
      "visuals": {
        "layout": "center",
        "elements": [
          { "type": "text-formula", "content": "ẍ + 2γ ẋ + ω₀² x = 0", "delay": 0.4, "color": "var(--chalk-200)", "position": "centred, serif italic" },
          { "type": "text-caption", "content": "γ = b / 2m   ω₀ = √(k/m)", "delay": 1.4, "color": "var(--chalk-300)", "position": "small mono caption below the equation" },
          { "type": "text-caption", "content": "underdamped (γ < ω₀) — solve the diff-eq", "delay": 2.4, "color": "var(--chalk-300)", "position": "tiny eyebrow above payoff" },
          { "type": "text-formula", "content": "x(t) = A e^(-γt) sin(ωt + φ)", "delay": 3.0, "color": "var(--amber-300)", "position": "large amber payoff, centre" },
          { "type": "text-caption", "content": "ω = √(ω₀² − γ²) — slightly slower than the undamped rhythm", "delay": 4.4, "color": "var(--chalk-300)", "position": "small footnote below payoff" }
        ]
      }
    },
    {
      "id": "dampedTrace",
      "start": 26.04,
      "end": 37.41,
      "narration": "Watch each swing fall a little short of the last, while the dashed envelope curves squeeze in toward zero — the amplitude shrinks, but the rhythm survives.",
      "visuals": {
        "layout": "full",
        "elements": [
          { "type": "graph-axes", "content": "Time axis along the bottom, zero line through the middle", "delay": 0.0, "color": "var(--chalk-300)" },
          { "type": "svg-label", "content": "t axis label at right end of horizontal axis", "delay": 0.4, "color": "var(--chalk-300)" },
          { "type": "svg-label", "content": "x(t) label at the top-left of the plot", "delay": 0.5, "color": "var(--chalk-200)" },
          { "type": "graph-curve", "content": "Upper envelope +A·e^(-γt) — dashed chalk, traces in synchronously", "delay": 0.4, "color": "var(--chalk-300)", "note": "value-driven trace, drawn 0..end of beat" },
          { "type": "graph-curve", "content": "Lower envelope -A·e^(-γt) — dashed chalk, traces in synchronously", "delay": 0.4, "color": "var(--chalk-300)" },
          { "type": "graph-curve", "content": "Damped sine x(t) = A·e^(-γt)·sin(ωt) traced left-to-right at real time", "delay": 0.6, "color": "var(--amber-400)", "note": "GENUINE ANIMATION — value-driven, head dot tracks the current x value" },
          { "type": "graph-marker", "content": "Pen dot following the head of the trace", "delay": 0.6, "color": "var(--rose-400)" },
          { "type": "text-caption", "content": "amplitude shrinks like e^(−γt) — but the rhythm survives", "delay": 7.5, "color": "var(--chalk-300)", "position": "below plot, sans 14" }
        ]
      }
    },
    {
      "id": "regimes",
      "start": 37.41,
      "end": 49,
      "narration": "Crank the drag higher and the oscillation disappears. Crank it just right and the spring returns home in the shortest time without overshooting.",
      "visuals": {
        "layout": "left-right",
        "elements": [
          { "type": "graph-curve", "content": "Underdamped curve — bobs and decays (γ < ω₀)", "delay": 0.5, "color": "var(--amber-400)", "position": "left panel" },
          { "type": "svg-label", "content": "label: underdamped (γ < ω₀)", "delay": 0.5, "color": "var(--chalk-300)", "position": "below left panel" },
          { "type": "graph-curve", "content": "Critically damped curve — returns home fastest, no overshoot (γ = ω₀)", "delay": 2.5, "color": "var(--rose-400)", "position": "centre panel" },
          { "type": "svg-label", "content": "label: critical (γ = ω₀)", "delay": 2.5, "color": "var(--chalk-300)", "position": "below centre panel" },
          { "type": "graph-curve", "content": "Overdamped curve — creeps back slowly (γ > ω₀)", "delay": 4.5, "color": "var(--violet-400)", "position": "right panel" },
          { "type": "svg-label", "content": "label: overdamped (γ > ω₀)", "delay": 4.5, "color": "var(--chalk-300)", "position": "below right panel" },
          { "type": "text-caption", "content": "Damping never adds rhythm — it only steals amplitude.", "delay": 6.6, "color": "var(--chalk-100)", "position": "centre, serif italic ~22px below the three panels" }
        ]
      }
    }
  ]
}
