{
  "id": "rl-transient",
  "title": "RL Transient: Why an Inductor Slows the Current",
  "eyebrow": "reactive elements",
  "language": "en",
  "duration": 46,
  "topic": "Series RL transient — when the switch closes, current rises along i(t) = (V/R)(1 - e^{-t/τ}) with τ = L/R, because the inductor opposes any change in current and develops a back-emf that decays as the current settles.",
  "subject_id": "ade",
  "chapter_number": 8,
  "prerequisites": [
    "rc-charging"
  ],
  "beats": [
    {
      "id": "manimoIntro",
      "start": 0,
      "end": 5.62,
      "narration": "Flip a switch onto an inductor — and the current refuses to jump. What's stopping it?",
      "visuals": {
        "layout": "center",
        "elements": [
          {
            "type": "manimo-enter",
            "content": "Manimo bobs in centre-screen",
            "delay": 0
          },
          {
            "type": "text-caption",
            "content": "Switch closes — but the current eases in. Why?",
            "delay": 0.7,
            "color": "var(--chalk-100)",
            "position": "right of Manimo"
          }
        ]
      }
    },
    {
      "id": "circuit",
      "start": 5.62,
      "end": 14.57,
      "narration": "Battery V in series with a resistor R and an inductor L. Close the switch — current starts to rise, but the inductor pushes back.",
      "visuals": {
        "layout": "center",
        "elements": [
          {
            "type": "svg-path",
            "content": "Rectangular loop wire",
            "delay": 0.2,
            "color": "var(--chalk-200)"
          },
          {
            "type": "svg-path",
            "content": "Battery on left vertical with V label",
            "delay": 0.3,
            "color": "var(--amber-300)"
          },
          {
            "type": "svg-path",
            "content": "Switch on top wire, opens then rotates closed",
            "delay": 1,
            "color": "var(--rose-400)"
          },
          {
            "type": "svg-path",
            "content": "Resistor zigzag on right vertical upper",
            "delay": 0.7,
            "color": "var(--amber-400)"
          },
          {
            "type": "svg-path",
            "content": "Inductor coil (4 humps) on right vertical lower",
            "delay": 0.8,
            "color": "var(--amber-400)"
          },
          {
            "type": "svg-label",
            "content": "Back-emf arrow on the inductor opposing current",
            "delay": 4,
            "color": "var(--rose-400)"
          },
          {
            "type": "text-caption",
            "content": "the inductor opposes any change in current",
            "delay": 7,
            "color": "var(--chalk-300)",
            "position": "below the circuit"
          }
        ]
      }
    },
    {
      "id": "twoCurves",
      "start": 14.57,
      "end": 25.02,
      "narration": "The current rises along an exponential curve toward V over R, while the voltage across the inductor decays from V down to zero — perfect mirror images.",
      "visuals": {
        "layout": "left-right",
        "elements": [
          {
            "type": "graph-axes",
            "content": "Time axis with i(t) and V_L(t) on same chart",
            "delay": 0.2,
            "color": "var(--chalk-300)"
          },
          {
            "type": "graph-curve",
            "content": "i(t) = (V/R)(1 - e^{-t/τ}) — rises from 0 toward V/R, amber",
            "delay": 1,
            "color": "var(--amber-400)"
          },
          {
            "type": "graph-curve",
            "content": "V_L(t) = V·e^{-t/τ} — decays from V toward 0, rose",
            "delay": 1,
            "color": "var(--rose-400)"
          },
          {
            "type": "graph-marker",
            "content": "time cursor sweeping across",
            "delay": 1,
            "color": "var(--chalk-200)"
          },
          {
            "type": "text-formula",
            "content": "i(t) = (V/R)(1 − e^{−t/τ})",
            "delay": 9.5,
            "color": "var(--amber-300)",
            "position": "below the chart"
          }
        ]
      }
    },
    {
      "id": "timeConstant",
      "start": 25.02,
      "end": 35.12,
      "narration": "Tau equals L over R is the time constant. After one tau the current has reached sixty three percent of its final value. After five tau it is essentially full.",
      "visuals": {
        "layout": "center",
        "elements": [
          {
            "type": "text-formula",
            "content": "τ = L/R",
            "delay": 0.3,
            "color": "var(--amber-300)",
            "position": "headline"
          },
          {
            "type": "graph-curve",
            "content": "i(t) curve with τ marker (63%) and 5τ marker (~99%)",
            "delay": 0.6,
            "color": "var(--amber-400)"
          },
          {
            "type": "graph-marker",
            "content": "τ marker — vertical dashed line plus dot at 63% of V/R",
            "delay": 1.3,
            "color": "var(--rose-400)"
          },
          {
            "type": "graph-marker",
            "content": "5τ marker — vertical dashed line plus dot at ~99% of V/R",
            "delay": 2.8,
            "color": "var(--rose-400)"
          },
          {
            "type": "text-caption",
            "content": "one τ → 63%   ·   five τ → essentially full",
            "delay": 4.5,
            "color": "var(--chalk-200)",
            "position": "below the chart"
          }
        ]
      }
    },
    {
      "id": "takeaway",
      "start": 35.12,
      "end": 46,
      "narration": "Bigger L slows the rise; bigger R hurries it. The time constant L over R sets the rhythm — the exact opposite trade-off from R C.",
      "visuals": {
        "layout": "center",
        "elements": [
          {
            "type": "text-caption",
            "content": "Bigger L → slower rise.  Bigger R → faster rise.",
            "delay": 0.3,
            "color": "var(--chalk-100)",
            "position": "centre, serif italic"
          },
          {
            "type": "text-formula",
            "content": "τ = L/R sets the rhythm.",
            "delay": 1.6,
            "color": "var(--amber-300)",
            "position": "below"
          }
        ]
      }
    }
  ]
}
