{
  "id": "finite-state-machine",
  "title": "Finite State Machines: A Circuit That Remembers Where It Was",
  "eyebrow": "sequential logic",
  "language": "en",
  "duration": 39,
  "topic": "Finite state machines — model sequential logic as a graph of states and labelled transitions; a Moore-style 11-detector with three states (S0, S1, S2) walks an input bit-stream and asserts its output whenever it has just seen two ones in a row",
  "subject_id": "ade",
  "chapter_number": 10,
  "prerequisites": ["d-flip-flop"],
  "beats": [
    {
      "id": "manimoIntro",
      "start": 0,
      "end": 5.14,
      "narration": "A digital circuit that remembers what just happened — how do we describe it?",
      "visuals": {
        "layout": "center",
        "elements": [
          { "type": "manimo-enter", "content": "Manimo enters centre", "delay": 0 },
          { "type": "text-caption", "content": "A circuit with memory — what is it remembering?", "delay": 0.7, "color": "var(--chalk-100)", "position": "right of Manimo, serif italic" }
        ]
      }
    },
    {
      "id": "graph",
      "start": 5.14,
      "end": 13.39,
      "narration": "Draw a state graph. Three bubbles for three memory states, arrows labelled with the input bit that triggers each transition.",
      "visuals": {
        "layout": "center",
        "elements": [
          { "type": "svg-circle", "content": "Three state bubbles S0, S1, S2 arranged in a triangle", "delay": 0.3, "color": "var(--amber-400)" },
          { "type": "svg-path", "content": "Transition arrows: S0 -1- S1, S1 -1- S2, S1 -0- S0, S2 -0- S0, S2 -1- S2 (self-loop), S0 -0- S0 (self-loop)", "delay": 1.6, "color": "var(--chalk-200)" },
          { "type": "svg-label", "content": "State annotations: S0=idle, S1=saw 1, S2=saw 11 (output high)", "delay": 4.0, "color": "var(--chalk-300)" }
        ]
      }
    },
    {
      "id": "walk",
      "start": 13.39,
      "end": 22.57,
      "narration": "Feed a bitstream in, one bit per clock tick. The current state bubble lights up; the transition arrow pulses as the next bit decides where to go next.",
      "visuals": {
        "layout": "top-bottom",
        "elements": [
          { "type": "svg-label", "content": "Bitstream row at the top — 0 1 1 0 1 1 1 0 — with a cursor sliding bit by bit", "delay": 0.3, "color": "var(--chalk-200)" },
          { "type": "svg-circle", "content": "Same FSM graph below, with the active state glowing as the cursor advances", "delay": 0.6, "color": "var(--amber-300)" },
          { "type": "svg-path", "content": "The just-fired transition arrow flashes on each tick", "delay": 1.0, "color": "var(--amber-400)" }
        ]
      }
    },
    {
      "id": "output",
      "start": 22.57,
      "end": 30.3,
      "narration": "The output is high only when the machine is parked in S two — that means it has just seen two ones in a row.",
      "visuals": {
        "layout": "top-bottom",
        "elements": [
          { "type": "graph-curve", "content": "Output Z trace synchronously with the walked bitstream — high during the bits where the FSM sits in S2, zero elsewhere", "delay": 0.3, "color": "var(--amber-300)" },
          { "type": "text-formula", "content": "Z = 1 iff state == S2 (Moore output)", "delay": 2.6, "color": "var(--amber-300)", "position": "below trace" }
        ]
      }
    },
    {
      "id": "takeaway",
      "start": 30.3,
      "end": 39,
      "narration": "States, transitions, outputs — that is every controller, every protocol, every counter you will ever build.",
      "visuals": {
        "layout": "center",
        "elements": [
          { "type": "text-caption", "content": "states + transitions + outputs = sequential logic", "delay": 0.3, "color": "var(--chalk-100)", "position": "centre takeaway" },
          { "type": "text-caption", "content": "(register holds the state, combinational logic fires transitions)", "delay": 1.6, "color": "var(--chalk-300)", "position": "small caption below" }
        ]
      }
    }
  ]
}
